Unnamed: 0,text,label,timestamp,cleaned_text,sentiment
127,I don't know how many years it took me to jump in until I could feel the descent without worrying ²,Anxiety,2024-05-07,i dont know how many years it took me to jump in until i could feel the descent without worrying ²,Positive
128,"I want to ask, have you ever been worried about the things you like? Even because you really like it, you feel like it's a part of your life. But every time you do or remember it you get worried. What do you think you should do? :(",Anxiety,2024-05-08,i want to ask have you ever been worried about the things you like even because you really like it you feel like its a part of your life but every time you do or remember it you get worried what do you think you should do ,Positive
129,"However, every time I picket, I'm always nervous: ""Even though I'm just a picket, I'm really scared, I'm excited:""",Anxiety,2024-05-09,however every time i picket im always nervous even though im just a picket im really scared im excited,Positive
130,BY GOD I'M STILL WORRY.,Anxiety,2024-05-10,by god im still worry,Neutral
131,"time goes on..days go on..at the same time my heart is getting restless and hurt...oh Allah I know you are testing me with this patience, and you are testing me with everything that happens..forgive me who is starting to weaken and lose enthusiasm for keep fighting and survive...",Anxiety,2024-05-11,time goes ondays go onat the same time my heart is getting restless and hurtoh allah i know you are testing me with this patience and you are testing me with everything that happensforgive me who is starting to weaken and lose enthusiasm for keep fighting and survive,Neutral
132,I want to exhale the restlessness in my chest with my breath,Anxiety,2024-05-12,i want to exhale the restlessness in my chest with my breath,Neutral
133,Why every morning I want to sleep I'm restless ,Anxiety,2024-05-13,why every morning i want to sleep im restless ,Neutral
134,"Anxious alone, sad alone, not having peace",Anxiety,2024-05-14,anxious alone sad alone not having peace,Negative
135,"What's wrong I'm worried, oh I hope it's okay",Anxiety,2024-05-15,whats wrong im worried oh i hope its okay,Neutral
136,"I really like this, I'm nervous about things I'm not sure about, I don't know why but I feel really nervous. WEIRD.",Anxiety,2024-05-16,i really like this im nervous about things im not sure about i dont know why but i feel really nervous weird,Negative
137,"I'm so nervous, why?",Anxiety,2024-05-17,im so nervous why,Neutral
138,but my heart is still restless even though my mouth is talking,Anxiety,2024-05-18,but my heart is still restless even though my mouth is talking,Neutral
139,Since then I was restless to the point of choking. What's wrong?,Anxiety,2024-05-19,since then i was restless to the point of choking whats wrong,Negative
140,"Starting to worry again if you have a lot of schedules, even though yesterday it was neatly arranged. How come biso missed ouch :')",Anxiety,2024-05-20,starting to worry again if you have a lot of schedules even though yesterday it was neatly arranged how come biso missed ouch ,Neutral
141,"Adf-my does anyone know why I am here? I've been feeling restless since yesterday, like worrying/worrying too much, suddenly feeling sad, just scared. But I also don't know why",Anxiety,2024-05-21,adfmy does anyone know why i am here ive been feeling restless since yesterday like worryingworrying too much suddenly feeling sad just scared but i also dont know why,Negative
142,"Gegana, restless, speechless, I don't know what the cause is:""",Anxiety,2024-05-22,gegana restless speechless i dont know what the cause is,Neutral
143,I'm lazy.. I'm so nervous,Anxiety,2024-05-23,im lazy im so nervous,Negative
144,Happy but also worried.,Anxiety,2024-05-24,happy but also worried,Positive
145,It's anxious to worry,Anxiety,2024-05-25,its anxious to worry,Negative
146,"Honestly, I'm really nervous",Anxiety,2024-05-26,honestly im really nervous,Positive
147,"Here from now on, my heart is restless",Anxiety,2024-05-27,here from now on my heart is restless,Neutral
148,"Later when you are tired of the new one, and then you look back and feel guilty for me, don't be a bit nervous. Trust me, I have forgiven you. Even though I will never accept you again.",Anxiety,2024-05-28,later when you are tired of the new one and then you look back and feel guilty for me dont be a bit nervous trust me i have forgiven you even though i will never accept you again,Negative
149,"I need adit not for stalking or for strange things because I myself have started to learn not to stalk just because I'm afraid that mental disorders will get worse even though I still feel anxious and afraid if I don't stalk, I can hold it so that Adit doesn't feel disturbed",Anxiety,2024-05-29,i need adit not for stalking or for strange things because i myself have started to learn not to stalk just because im afraid that mental disorders will get worse even though i still feel anxious and afraid if i dont stalk i can hold it so that adit doesnt feel disturbed,Negative
150,Keep restless astagfirullah,Anxiety,2024-05-30,keep restless astagfirullah,Neutral
151,"I'm excited but I don't know why, there's no reason, I'm nervous, I have a stomach ache but I'm scared, I know I'm tired, this is the third time today, hah â€” hah :)",Anxiety,2024-05-31,im excited but i dont know why theres no reason im nervous i have a stomach ache but im scared i know im tired this is the third time today hah â hah ,Negative
152,"Always worried about the future, even though today has not changed.",Anxiety,2024-06-01,always worried about the future even though today has not changed,Neutral
153,"every time you worry, why is the disease running to your stomach?",Anxiety,2024-06-02,every time you worry why is the disease running to your stomach,Neutral
154,"If you're nervous looking for the best position before going to sleep, it feels like someone's watching you ™„",Anxiety,2024-06-03,if youre nervous looking for the best position before going to sleep it feels like someones watching you ,Positive
155,Restless and agitated,Anxiety,2024-06-04,restless and agitated,Neutral
156,"In the evening, towards the morning. A little worried, a lot of longing",Anxiety,2024-06-05,in the evening towards the morning a little worried a lot of longing,Negative
157,"Some days, I don't think I'm doing well, so I feel like I'm really crying, scared, anxious, just sad. until I think of this when I cry, does my fast break or not?",Anxiety,2024-06-06,some days i dont think im doing well so i feel like im really crying scared anxious just sad until i think of this when i cry does my fast break or not,Negative
158,"It's been a few days when I sleep by default I'm afraid, restless, nervous, feel alone, sometimes my breath is really heavy.....why is that... like I'm afraid of being restless, oh my God",Anxiety,2024-06-07,its been a few days when i sleep by default im afraid restless nervous feel alone sometimes my breath is really heavywhy is that like im afraid of being restless oh my god,Negative
159,"tired of overtingking, tired of worrying too much, tired of being tired",Anxiety,2024-06-08,tired of overtingking tired of worrying too much tired of being tired,Negative
160,aren't you worried? aren't you worried? don't you worry...,Anxiety,2024-06-09,arent you worried arent you worried dont you worry,Neutral
161,"Instead of getting calmer, this heart is getting more restless",Anxiety,2024-06-10,instead of getting calmer this heart is getting more restless,Positive
162,can i tap the dm or not? I'm very nervous thinking,Anxiety,2024-06-11,can i tap the dm or not im very nervous thinking,Positive
163,Finally restless again uhh mmhhh ahh,Anxiety,2024-06-12,finally restless again uhh mmhhh ahh,Neutral
164,"No need to run, just walk one by one the stones that are being stepped on slowly and absorb it without feeling anxious and full of emotions",Anxiety,2024-06-13,no need to run just walk one by one the stones that are being stepped on slowly and absorb it without feeling anxious and full of emotions,Negative
165,"Lately I'm feeling scared & very anxious thinking about the day for tomorrow's work inspector . Honestly, I'm really scared because I'm not very close to friends, I'm afraid I can't, I'm afraid to disappoint, and if I suddenly remember I cry",Anxiety,2024-06-14,lately im feeling scared  very anxious thinking about the day for tomorrows work inspector  honestly im really scared because im not very close to friends im afraid i cant im afraid to disappoint and if i suddenly remember i cry,Negative
166,"This is why I can't sleep, I'm so restless...",Anxiety,2024-06-15,this is why i cant sleep im so restless,Neutral
167,I want to exhale the restlessness in my chest with my breath,Anxiety,2024-06-16,i want to exhale the restlessness in my chest with my breath,Neutral
168,Restless restlessness accompanies,Anxiety,2024-06-17,restless restlessness accompanies,Neutral
169,hlt! why do i like to be nervous tbtb keep worrying so much that i sweat,Anxiety,2024-06-18,hlt why do i like to be nervous tbtb keep worrying so much that i sweat,Positive
170,"Not many people are sure of their prayers, not many people are faithful to wait with what is prayed for. Prayer is unique, there is hope and feeling, there is worry and anxiety, there is tears and happiness. But the end of the prayer will always be the best for humans.",Anxiety,2024-06-19,not many people are sure of their prayers not many people are faithful to wait with what is prayed for prayer is unique there is hope and feeling there is worry and anxiety there is tears and happiness but the end of the prayer will always be the best for humans,Positive
171,"I wonder why my heart beats like that sometimes for weeks, then it's back to normal for a few weeks, does anyone know why this isn't it? Or maybe I'm often anxious and stressed, okay?",Anxiety,2024-06-20,i wonder why my heart beats like that sometimes for weeks then its back to normal for a few weeks does anyone know why this isnt it or maybe im often anxious and stressed okay,Positive
172,"I'm so nervous I swear, the views are getting slower",Anxiety,2024-06-21,im so nervous i swear the views are getting slower,Neutral
173,Just woke up feeling restless and sore ™„,Anxiety,2024-06-22,just woke up feeling restless and sore ,Neutral
174,I'm so worried 5 days of not coming home wey,Anxiety,2024-06-23,im so worried 5 days of not coming home wey,Neutral
175,My life is chaos. There is no solution. Fear of the uncertain. Restless direction.,Anxiety,2024-06-24,my life is chaos there is no solution fear of the uncertain restless direction,Neutral
176,UNDERSTANDING FEEL FEELING«,Anxiety,2024-06-25,understanding feel feeling,Neutral
177,I really can't be told to just listen to it for hours. Immediately anxious innate.,Anxiety,2024-06-26,i really cant be told to just listen to it for hours immediately anxious innate,Negative
178,I haven't given up… just a little restless.,Anxiety,2024-06-27,i havent given up just a little restless,Negative
179,Actually I'm worried. The original looks really scared. I've come to play/bite my nails :(,Anxiety,2024-06-28,actually im worried the original looks really scared ive come to playbite my nails ,Positive
180,"If I'm honest, I've been nervous since that day even though I said it wasn't....",Anxiety,2024-06-29,if im honest ive been nervous since that day even though i said it wasnt,Positive
181,"Lately, I've been feeling restless and restless. Haihh",Anxiety,2024-06-30,lately ive been feeling restless and restless haihh,Negative
182,"I'm so nervous, why isn't it?",Anxiety,2024-07-01,im so nervous why isnt it,Neutral
183,"The default bat is restless, I don't know why",Anxiety,2024-07-02,the default bat is restless i dont know why,Neutral
184,you know you're restless,Anxiety,2024-07-03,you know youre restless,Neutral
185,"Restless,. Locked in all motion. Whipped in the brain noisy debate about decisions. Make friends with fear and risk",Anxiety,2024-07-04,restless locked in all motion whipped in the brain noisy debate about decisions make friends with fear and risk,Neutral
186,"Wow, I'm getting restless, let's sleep",Anxiety,2024-07-05,wow im getting restless lets sleep,Positive
187,"I swear I'm so nervous, why don't you",Anxiety,2024-07-06,i swear im so nervous why dont you,Neutral
188,"I was a little worried that the afternoon class would actually be able to reach the target. But God just gave a way, wednesday class was moved even though it was a quiz. At least later in the morning you can make out with data until iftar",Anxiety,2024-07-07,i was a little worried that the afternoon class would actually be able to reach the target but god just gave a way wednesday class was moved even though it was a quiz at least later in the morning you can make out with data until iftar,Positive
189,"–¤ When you're anxious or nervous, do you feel like your heart feels weird, doesn't it? Is it just me?",Anxiety,2024-07-08, when youre anxious or nervous do you feel like your heart feels weird doesnt it is it just me,Negative
190,"Come on, come on, let's go... 10 years could be passed before, it's not even a month yet, I'm already restless",Anxiety,2024-07-09,come on come on lets go 10 years could be passed before its not even a month yet im already restless,Neutral
191,"Time is slow for those who wait, too long for those who are restless, and too short for those who are happy",Anxiety,2024-07-10,time is slow for those who wait too long for those who are restless and too short for those who are happy,Positive
192,"Restless, restless, become one. Can't agree. Can't even sleep",Anxiety,2024-07-11,restless restless become one cant agree cant even sleep,Neutral
193,"May May be accompanied by good news. The injured, get well soon. Sorrow turns to love. Quieter anxiety. And prayers that are more patient...#senjamu",Anxiety,2024-07-12,may may be accompanied by good news the injured get well soon sorrow turns to love quieter anxiety and prayers that are more patientsenjamu,Positive
194,"Since then, the chicken cake has been restless and wants to lay eggs.",Anxiety,2024-07-13,since then the chicken cake has been restless and wants to lay eggs,Negative
195,Do not compare yourself to others. Envy only makes restless soul. Be yourself.,Anxiety,2024-07-14,do not compare yourself to others envy only makes restless soul be yourself,Neutral
196,"The 5 dream ones were moved to a new unit, so why isn't the Anjrit so worried?",Anxiety,2024-07-15,the 5 dream ones were moved to a new unit so why isnt the anjrit so worried,Positive
197,"finished for the heart's intention to watch the series, I even thought about it. I'm worried",Anxiety,2024-07-16,finished for the hearts intention to watch the series i even thought about it im worried,Neutral
198,"""No regrets or grudges/angry at things that have passed, and don't put too much anxiety over the record period #COYS",Anxiety,2024-07-17,no regrets or grudgesangry at things that have passed and dont put too much anxiety over the record period coys,Positive
199,"Usually, if you're restless for a long time, surely after that something will happen or not",Anxiety,2024-07-18,usually if youre restless for a long time surely after that something will happen or not,Positive
200,"Have you ever thought of something and then immediately forgot it then thought you were thinking about this bastard, I don't remember it, so I was restless",Anxiety,2024-07-19,have you ever thought of something and then immediately forgot it then thought you were thinking about this bastard i dont remember it so i was restless,Neutral
201,"Dialogue in the morning.. to yourself, restless and restless accompanying it, hoping someone will understand-",Anxiety,2024-07-20,dialogue in the morning to yourself restless and restless accompanying it hoping someone will understand,Neutral
202,I'm the only one who's nervous.,Anxiety,2024-07-21,im the only one whos nervous,Neutral
203,I'm starting to worry,Anxiety,2024-07-22,im starting to worry,Neutral
204,"In my father's family, everyone is smart, I'm sure the expectations for me are also high it makes me very anxious to think about this huhu",Anxiety,2024-07-23,in my fathers family everyone is smart im sure the expectations for me are also high it makes me very anxious to think about this huhu,Positive
205,"Already complete. Disappointed with a broken heart. Produces a sense of restlessness. I don't know, hopefully all of this ends beautifully",Anxiety,2024-07-24,already complete disappointed with a broken heart produces a sense of restlessness i dont know hopefully all of this ends beautifully,Negative
206,"when your bipolar relapse welcome shortness of breath, tremors, anxiety, fear, selfharm etc",Anxiety,2024-07-25,when your bipolar relapse welcome shortness of breath tremors anxiety fear selfharm etc,Positive
207,"How come lately I'm not feeling well, like mellow, not calm, restless",Anxiety,2024-07-26,how come lately im not feeling well like mellow not calm restless,Negative
208,"When you think about it and don't finish it, it feels really restless",Anxiety,2024-07-27,when you think about it and dont finish it it feels really restless,Positive
209,I'm worried.. I'm in a bad mood.. but excited to see law school..,Anxiety,2024-07-28,im worried im in a bad mood but excited to see law school,Negative
210,"Yes, what will happen later :'), I'm worried that I can control my emotions",Anxiety,2024-07-29,yes what will happen later  im worried that i can control my emotions,Neutral
211,"I'm really nervous about choosing between boring or chilling, PLEASE",Anxiety,2024-07-30,im really nervous about choosing between boring or chilling please,Negative
212,"oh my god why have you been a week, you're so nervous, it's really bad aaa",Anxiety,2024-07-31,oh my god why have you been a week youre so nervous its really bad aaa,Negative
213,"people seem calm, happy like there's no problem because only one smile we throw out but sad, restless and anxious millions of which we keep to ourselves, only we know.",Anxiety,2024-08-01,people seem calm happy like theres no problem because only one smile we throw out but sad restless and anxious millions of which we keep to ourselves only we know,Positive
214,"In the past, if you knew there were people who didn't like me, you would immediately be worried, sad, find out why someone didn't like you.",Anxiety,2024-08-02,in the past if you knew there were people who didnt like me you would immediately be worried sad find out why someone didnt like you,Negative
215,"Fearful. Often experiences feelings of extreme worry, sadness, or anxiety.",Anxiety,2024-08-03,fearful often experiences feelings of extreme worry sadness or anxiety,Negative
216,"crazy, why are you nervous? *plays yo-yo*",Anxiety,2024-08-04,crazy why are you nervous plays yoyo,Negative
217,"a lot of work tomorrow a suddenly meeting, stomach acid rises, dizziness, can't sleep, restless. what should i do",Anxiety,2024-08-05,a lot of work tomorrow a suddenly meeting stomach acid rises dizziness cant sleep restless what should i do,Neutral
218,"Unsettled !! That's when there is a test. But face it and get over it. It's been like that since the school days, the present can't be done like that. It could be",Anxiety,2024-08-06,unsettled  thats when there is a test but face it and get over it its been like that since the school days the present cant be done like that it could be,Neutral
219,"Panic, don't know what to panic about. Restless alone, think too",Anxiety,2024-08-07,panic dont know what to panic about restless alone think too,Neutral
220,"I can't stop, my nutmeg pops up eyes that I have to look at when I'm anxious",Anxiety,2024-08-08,i cant stop my nutmeg pops up eyes that i have to look at when im anxious,Negative
221,"I'm really scared, nervous every day…",Anxiety,2024-08-09,im really scared nervous every day,Positive
222,how do you stay calm so nervous after reading this.,Anxiety,2024-08-10,how do you stay calm so nervous after reading this,Positive
223,"Strange. I don't have work today and I have a bit of free time so I can read shrill novels but... it feels weird. I've been nervous about checking the google calendar just in case if I read it wrong. But it's still weird, how about this, like you should be looking for a job to get rid of this feeling.",Anxiety,2024-08-11,strange i dont have work today and i have a bit of free time so i can read shrill novels but it feels weird ive been nervous about checking the google calendar just in case if i read it wrong but its still weird how about this like you should be looking for a job to get rid of this feeling,Negative
224,Is there something that makes me nervous,Anxiety,2024-08-12,is there something that makes me nervous,Neutral
225,"I don't know why, after every Eid prayer, I suddenly feel restless, it's not clear in the end, I'm not in the mood for friendship or what people usually do on Eid :(",Anxiety,2024-08-13,i dont know why after every eid prayer i suddenly feel restless its not clear in the end im not in the mood for friendship or what people usually do on eid ,Negative
226,"If you are stuck sleeping at 11am until set 12. If you are more than that, you will be anxious, why are you?”",Anxiety,2024-08-14,if you are stuck sleeping at 11am until set 12 if you are more than that you will be anxious why are you,Positive
227,"Have you ever been so nervous, scared, and anxious that you want to throw up?",Anxiety,2024-08-15,have you ever been so nervous scared and anxious that you want to throw up,Negative
228,Do not compare yourself to others. Envy only makes restless soul. Be yourself.,Anxiety,2024-08-16,do not compare yourself to others envy only makes restless soul be yourself,Neutral
229,"When I'm done with this, why do I feel so dizzy.... But I swear I don't want to sleep, I'm really nervous when I'm told to sleep.",Anxiety,2024-08-17,when im done with this why do i feel so dizzy but i swear i dont want to sleep im really nervous when im told to sleep,Positive
230,"I don't know whether to be happy or sad. And don't know how long this feeling will last? I'm the one who feels it just great every day coy.. confused about my own feelings. Sllu not calm, restless. But, just give up.. there is God. My son, yes.. Shaina can.",Anxiety,2024-08-18,i dont know whether to be happy or sad and dont know how long this feeling will last im the one who feels it just great every day coy confused about my own feelings sllu not calm restless but just give up there is god my son yes shaina can,Positive
231,"I just want to pass, there are so many obstacles « I'm so tired guyssss I want to rest for a while but I can't seem nervou",Anxiety,2024-08-19,i just want to pass there are so many obstacles  im so tired guyssss i want to rest for a while but i cant seem nervou,Positive
232,"It's true that social media is fun, you have to look for health, if it only makes you nervous, what do you do",Anxiety,2024-08-20,its true that social media is fun you have to look for health if it only makes you nervous what do you do,Positive
233,"Starting to get restless...Others have started praying Isha, I'm not solemn, the cat is getting closer...Finally canceled the prayer to get rid of the cat",Anxiety,2024-08-21,starting to get restlessothers have started praying isha im not solemn the cat is getting closerfinally canceled the prayer to get rid of the cat,Neutral
234,What do you do when you're anxious when you're anxious? i used to write something every time i have a lot of thoughts or worry about things that are not sure... but now... idk what to do </3,Anxiety,2024-08-22,what do you do when youre anxious when youre anxious i used to write something every time i have a lot of thoughts or worry about things that are not sure but now idk what to do 3,Negative
235,I'm so nervous ° [],Anxiety,2024-08-23,im so nervous  ,Neutral
236,I like to worry tbtb,Anxiety,2024-08-24,i like to worry tbtb,Neutral
237,"When you're working on something, and suddenly feel restless and anxious even though nothing's going on...haha what's the matter, my self",Anxiety,2024-08-25,when youre working on something and suddenly feel restless and anxious even though nothings going onhaha whats the matter my self,Negative
238,Don't worry about it,Anxiety,2024-08-26,dont worry about it,Neutral
239,very nervous :'),Anxiety,2024-08-27,very nervous ,Positive
240,"I like not knowing myself. Having a mentality that is very easy to get down, often feels worried or anxious, has difficulty controlling thoughts, is very easily hurt. Sometimes what makes us suffer is to think too much about what other people say.",Anxiety,2024-08-28,i like not knowing myself having a mentality that is very easy to get down often feels worried or anxious has difficulty controlling thoughts is very easily hurt sometimes what makes us suffer is to think too much about what other people say,Positive
241,"I'm confused when I've finished something, what's next? I feel like everything is already there, but what's missing? The default is restless",Anxiety,2024-08-29,im confused when ive finished something whats next i feel like everything is already there but whats missing the default is restless,Negative
