Unnamed: 0,text,label,timestamp,cleaned_text,sentiment
242,"Honestly, from the past until now, since the last 4 years, my biggest enemy in writing is anxiety. There is no such detailed reason, it's just that I suddenly get nervous and it's not clear, so sometimes if it's really bad it can stop writing for months.",Anxiety,2024-08-30,honestly from the past until now since the last 4 years my biggest enemy in writing is anxiety there is no such detailed reason its just that i suddenly get nervous and its not clear so sometimes if its really bad it can stop writing for months,Positive
243,I'm even worried about myself :((,Anxiety,2024-08-31,im even worried about myself ,Neutral
244,"people seem calm, happy like there's no problem because only one smile we throw out but sad, restless and anxious millions of which we keep to ourselves, only we know.",Anxiety,2024-09-01,people seem calm happy like theres no problem because only one smile we throw out but sad restless and anxious millions of which we keep to ourselves only we know,Positive
245,"She worries a lot, so she cries a lot.",Anxiety,2024-09-02,she worries a lot so she cries a lot,Neutral
246,"troubled, restless heart, restless soul.",Anxiety,2024-09-03,troubled restless heart restless soul,Negative
247,why did I feel so nervous earlier?,Anxiety,2024-09-04,why did i feel so nervous earlier,Neutral
248,"I'm really restless when I just wake up, I feel like I immediately get bad thoughts and it's really every day",Anxiety,2024-09-05,im really restless when i just wake up i feel like i immediately get bad thoughts and its really every day,Negative
249,oh my god so nervous,Anxiety,2024-09-06,oh my god so nervous,Neutral
250,"Feeling anxious like this, every time you want to work, you have to feel anxious and not calm",Anxiety,2024-09-07,feeling anxious like this every time you want to work you have to feel anxious and not calm,Negative
251,"Even though I am calm like a fish, I am restless like a wave in the ocean. - RUMI..#MCO3",Anxiety,2024-09-08,even though i am calm like a fish i am restless like a wave in the ocean  rumimco3,Positive
252,"guys, how do you feel, every day you feel like you're really worried about your thesis, the trial schedule for August is great and until now it's still floating, you want to make revisions like your brain is empty, but every day you're so worried that you're shaking",Anxiety,2024-09-09,guys how do you feel every day you feel like youre really worried about your thesis the trial schedule for august is great and until now its still floating you want to make revisions like your brain is empty but every day youre so worried that youre shaking,Positive
253,Restless and restless.. Mboh... lah..,Anxiety,2024-09-10,restless and restless mboh lah,Neutral
254,Other people don't know I feel anxious every day.,Anxiety,2024-09-11,other people dont know i feel anxious every day,Negative
255,umami mami mami this heart is restless,Anxiety,2024-09-12,umami mami mami this heart is restless,Neutral
256,"I wake up this feeling of restlessness, the title is... I sleep late, I still wake up in the morning",Anxiety,2024-09-13,i wake up this feeling of restlessness the title is i sleep late i still wake up in the morning,Negative
257,"a little anxious, a lot afraid",Anxiety,2024-09-14,a little anxious a lot afraid,Negative
258,I'm afraid the anxiety is too much because I'm already in the phase of being really scared,Anxiety,2024-09-15,im afraid the anxiety is too much because im already in the phase of being really scared,Negative
259,"What exactly is making me nervous, please, tell me!",Anxiety,2024-09-16,what exactly is making me nervous please tell me,Positive
260,"a few days ago restless, today menses. I've just read that restlessness is a symptom of PMS. so who gave this anxiety, thesis or pms?",Anxiety,2024-09-17,a few days ago restless today menses ive just read that restlessness is a symptom of pms so who gave this anxiety thesis or pms,Negative
261,"Oh, I'm so nervous, bro :(",Anxiety,2024-09-18,oh im so nervous bro ,Neutral
262,"Eid is getting closer. Oh God, I feel so lazy to meet a big family, I'm too lazy to ask a lot of questions, it's not okay, I'm not comfortable, I'm really worried, fuck the life",Anxiety,2024-09-19,eid is getting closer oh god i feel so lazy to meet a big family im too lazy to ask a lot of questions its not okay im not comfortable im really worried fuck the life,Negative
263,"Suddenly restless, not even 5 minutes immediately severe nausea. It's true that stomach acid is the fastest way to get sick if you have thoughts ' »",Anxiety,2024-09-20,suddenly restless not even 5 minutes immediately severe nausea its true that stomach acid is the fastest way to get sick if you have thoughts  ,Negative
264,What is the sign of restlessness -_-,Anxiety,2024-09-21,what is the sign of restlessness _,Neutral
265,"They say I'm strong, I'm stoned, I always have panic attacks when I'm restless at night, it's not clear who knows, I don't leave my room all day because I'm so tired, I'm so tired, some people care, they say I'm lazy, even though they don't know why I'm like that. It seems like my mental health is not important",Anxiety,2024-09-22,they say im strong im stoned i always have panic attacks when im restless at night its not clear who knows i dont leave my room all day because im so tired im so tired some people care they say im lazy even though they dont know why im like that it seems like my mental health is not important,Negative
266,"so please be worried, what version will I get ™‚",Anxiety,2024-09-23,so please be worried what version will i get ,Neutral
267,restless and agitated,Anxiety,2024-09-24,restless and agitated,Neutral
268,"For the past few days, he's been a bit restless, he's not calm like that.",Anxiety,2024-09-25,for the past few days hes been a bit restless hes not calm like that,Negative
269,"I swear I'm nervous, why are you?",Anxiety,2024-09-26,i swear im nervous why are you,Neutral
270,"I've been so restless all day, why is it even though there's nothing... calm after praying, after that, I'm restless again",Anxiety,2024-09-27,ive been so restless all day why is it even though theres nothing calm after praying after that im restless again,Positive
271,"It's so toxic, every night I'm always afraid of forgetting to do something I'm so nervous gt anjr",Anxiety,2024-09-28,its so toxic every night im always afraid of forgetting to do something im so nervous gt anjr,Negative
272,"Today's energy is very heavy. You have to go to the doctor, have an ultrasound, then an X-ray. The results will be known tomorrow. Ugh, so worried.",Anxiety,2024-09-29,todays energy is very heavy you have to go to the doctor have an ultrasound then an xray the results will be known tomorrow ugh so worried,Negative
273,"Time is slow for those who wait, too long for those who are restless, and too short for those who are happy. ",Anxiety,2024-09-30,time is slow for those who wait too long for those who are restless and too short for those who are happy ,Positive
274,Feeling restless is the worst thing .ever.,Anxiety,2024-10-01,feeling restless is the worst thing ever,Negative
275,"Every night before this night, I always worry about what drama will happen tonight, my baby boy If there's no husband, this is really crazy",Anxiety,2024-10-02,every night before this night i always worry about what drama will happen tonight my baby boy if theres no husband this is really crazy,Negative
276,"Why be afraid of pain when all of our feelings can be created!.. There will always be calm, on the sidelines of anxiety waiting to subside...",Anxiety,2024-10-03,why be afraid of pain when all of our feelings can be created there will always be calm on the sidelines of anxiety waiting to subside,Negative
277,I'm so worried why yh.,Anxiety,2024-10-04,im so worried why yh,Neutral
278,"Restless restlessness accompanied, hoping someone would understand, wishing he wasn't here.",Anxiety,2024-10-05,restless restlessness accompanied hoping someone would understand wishing he wasnt here,Neutral
279,"I'm so nervous, I'm hungry too Bismillah yaa",Anxiety,2024-10-06,im so nervous im hungry too bismillah yaa,Neutral
280,Say! Are you worried about your health? Any tips so you don't worry too much?,Anxiety,2024-10-07,say are you worried about your health any tips so you dont worry too much,Positive
281,"I don't feel good, I'm not calm, I'm just restless :( let's do a lot of dhikr",Anxiety,2024-10-08,i dont feel good im not calm im just restless  lets do a lot of dhikr,Positive
282,I'm a bit scared and nervous...,Anxiety,2024-10-09,im a bit scared and nervous,Neutral
283,starting to get restless with life's journey like this,Anxiety,2024-10-10,starting to get restless with lifes journey like this,Neutral
284,restless eh,Anxiety,2024-10-11,restless eh,Neutral
285,Why am I so nervous?!!!,Anxiety,2024-10-12,why am i so nervous,Neutral
286,how do you get rid of anxiety,Anxiety,2024-10-13,how do you get rid of anxiety,Neutral
287,"I'm so restless, why isn't it",Anxiety,2024-10-14,im so restless why isnt it,Neutral
288,Why are you so worried since yesterday...,Anxiety,2024-10-15,why are you so worried since yesterday,Neutral
289,"O Allah, I just ask for a safe and peaceful life without being haunted by anxiety, O Allah",Anxiety,2024-10-16,o allah i just ask for a safe and peaceful life without being haunted by anxiety o allah,Positive
290,"For a long time, my heart feels like it's going to burst when it's restless",Anxiety,2024-10-17,for a long time my heart feels like its going to burst when its restless,Negative
291,"Now, he's always anxious every day, it feels like he's waiting for a thesis trial, you know. I understand it feels nervous, worried, afraid. what's the difference now that you don't know what you're worried about",Anxiety,2024-10-18,now hes always anxious every day it feels like hes waiting for a thesis trial you know i understand it feels nervous worried afraid whats the difference now that you dont know what youre worried about,Negative
292,The habit of being anxious is clear,Anxiety,2024-10-19,the habit of being anxious is clear,Negative
294,sleep but restless. understand?,Anxiety,2024-10-21,sleep but restless understand,Neutral
295,"I'm nervous but I don't know why, it's really not that good, I've been nervous. Hope all is well",Anxiety,2024-10-22,im nervous but i dont know why its really not that good ive been nervous hope all is well,Positive
296,"Anjir is so restless today, what's wrong?",Anxiety,2024-10-23,anjir is so restless today whats wrong,Negative
297,"The restlessness that hit, really disturbs the atmosphere",Anxiety,2024-10-24,the restlessness that hit really disturbs the atmosphere,Positive
298,"Shit! I'm addicted to playing cellphones so that if I don't have a cellphone, I feel restless. How do you get rid of it",Anxiety,2024-10-25,shit im addicted to playing cellphones so that if i dont have a cellphone i feel restless how do you get rid of it,Negative
299,"um! Pls, how do I feel afraid to go out of the house because I'm afraid to meet people, I don't know why, even though I wasn't like this before, I used to be nervous, then I'm so anxious I'm so sweaty",Anxiety,2024-10-26,um pls how do i feel afraid to go out of the house because im afraid to meet people i dont know why even though i wasnt like this before i used to be nervous then im so anxious im so sweaty,Negative
300,Why are you so nervous :(((,Anxiety,2024-10-27,why are you so nervous ,Neutral
301,"It seems like I'm really at the anxiety stage every time I open WhatsApp. It feels really anxious, scared, nervous, feeling guilty, feeling useless. I want to disappear, but discussing assignments and exhibitions there, all of them...",Anxiety,2024-10-28,it seems like im really at the anxiety stage every time i open whatsapp it feels really anxious scared nervous feeling guilty feeling useless i want to disappear but discussing assignments and exhibitions there all of them,Negative
302,"That's if you're worried/worried, the parno is too much. ^^",Anxiety,2024-10-29,thats if youre worriedworried the parno is too much ,Positive
303,very nervous,Anxiety,2024-10-30,very nervous,Positive
304,Restless restlessness accompanies,Anxiety,2024-10-31,restless restlessness accompanies,Neutral
305,hello? buddy it's been a long time since jbjb mutual. My account still looks like an RT bot huh .. tbh lately I've been feeling tired. Anxiety always comes suddenly for no reason so I think I hate myself even more. even yesterday i got to the point where the thought of hurting myself came to my brain,Anxiety,2024-11-01,hello buddy its been a long time since jbjb mutual my account still looks like an rt bot huh  tbh lately ive been feeling tired anxiety always comes suddenly for no reason so i think i hate myself even more even yesterday i got to the point where the thought of hurting myself came to my brain,Negative
306,-11fess starts again every night is restless :)))),Anxiety,2024-11-02,11fess starts again every night is restless ,Neutral
307,"One by one the family (women) who were almost the same age as Mama died. and the average below mama. starting to worry.....hope you are always healthy, ma ™",Anxiety,2024-11-03,one by one the family women who were almost the same age as mama died and the average below mama starting to worryhope you are always healthy ma ,Positive
308,"It used to be beautiful. But now it's real. Feels restless, restless, etc.;(",Anxiety,2024-11-04,it used to be beautiful but now its real feels restless restless etc,Positive
309,"""No regrets or grudges/angry at things that have passed, and not worrying too much about the future, that's true serenity.""",Anxiety,2024-11-05,no regrets or grudgesangry at things that have passed and not worrying too much about the future thats true serenity,Positive
310,"Can't sleep because I'm worried it's not really good, I can't take it to watch too",Anxiety,2024-11-06,cant sleep because im worried its not really good i cant take it to watch too,Negative
311,Seems like it's a lot of sin when you're so restless,Anxiety,2024-11-07,seems like its a lot of sin when youre so restless,Neutral
312,"Shit, worry again, throw up again!",Anxiety,2024-11-08,shit worry again throw up again,Negative
313,how about a prolonged period of anxiety..,Anxiety,2024-11-09,how about a prolonged period of anxiety,Neutral
314,"My mind is really divided, until I fell asleep like I was feeling anxious, but I don't know what to worry about.",Anxiety,2024-11-10,my mind is really divided until i fell asleep like i was feeling anxious but i dont know what to worry about,Negative
315,"There is excessive anxiety today, .And, there is another.",Anxiety,2024-11-11,there is excessive anxiety today and there is another,Negative
316,"I really do this istikhara prayer. The excitement is not crazy, I'm really worried",Anxiety,2024-11-12,i really do this istikhara prayer the excitement is not crazy im really worried,Positive
317,"Fwb, how do you calm a restless heart? It's not a boy problem. I'm f20",Anxiety,2024-11-13,fwb how do you calm a restless heart its not a boy problem im f20,Positive
318,The combination of anxiety and anxiety gives me a terrible headache..,Anxiety,2024-11-14,the combination of anxiety and anxiety gives me a terrible headache,Negative
319,Very worried,Anxiety,2024-11-15,very worried,Positive
320,"worry too much at this hour, God is so annoying",Anxiety,2024-11-16,worry too much at this hour god is so annoying,Negative
321,Tired of being restless every day :'(,Anxiety,2024-11-17,tired of being restless every day ,Negative
322,Too nervous,Anxiety,2024-11-18,too nervous,Neutral
323,"every time you gassy, ​​atine must be restless,, ono sing koyo ngono ga??",Anxiety,2024-11-19,every time you gassy atine must be restless ono sing koyo ngono ga,Neutral
324,The default is so restless haha,Anxiety,2024-11-20,the default is so restless haha,Positive
325,Confused since yesterday feeling restless but don't know what to worry about,Anxiety,2024-11-21,confused since yesterday feeling restless but dont know what to worry about,Negative
326,Q: Does anyone know of a sedative so you don't get excited? I wake up restless every time I don't know why or do I have any other suggestions so that it doesn't continue like this. thank you,Anxiety,2024-11-22,q does anyone know of a sedative so you dont get excited i wake up restless every time i dont know why or do i have any other suggestions so that it doesnt continue like this thank you,Positive
327,I'm dancing on the edge of restlessness,Anxiety,2024-11-23,im dancing on the edge of restlessness,Neutral
328,"Yoo, why are you nervous, yo",Anxiety,2024-11-24,yoo why are you nervous yo,Neutral
329,"Every time I hear that my friend wants to go to trial, I like to be nervous, it's not clear, I need to hurry to clean it too, but if I'm in a hurry because I see people are afraid, it's not really right :( wkwkwk",Anxiety,2024-11-25,every time i hear that my friend wants to go to trial i like to be nervous its not clear i need to hurry to clean it too but if im in a hurry because i see people are afraid its not really right  wkwkwk,Negative
330,"It's anjir, the past few days it's been really messy, so I'm nervous why the assignments don't show up . Usually Monday/Tuesday there are assignments and the deadline is Wednesday/Thursday -_-",Anxiety,2024-11-26,its anjir the past few days its been really messy so im nervous why the assignments dont show up  usually mondaytuesday there are assignments and the deadline is wednesdaythursday _,Negative
331,"I want to ask, but I'm afraid. If you don't ask, you'll get even more restless",Anxiety,2024-11-27,i want to ask but im afraid if you dont ask youll get even more restless,Negative
332,Waiting anxiously,Anxiety,2024-11-28,waiting anxiously,Negative
333,but my heart is still restless even though my mouth is talking,Anxiety,2024-11-29,but my heart is still restless even though my mouth is talking,Neutral
334,Don't worry even more about this dog,Anxiety,2024-11-30,dont worry even more about this dog,Positive
335,"Haven't prayed yet so restless, want to pray still lazy. Astaghfirullah",Anxiety,2024-12-01,havent prayed yet so restless want to pray still lazy astaghfirullah,Negative
336,why are you so nervous have mixed feelings,Anxiety,2024-12-02,why are you so nervous have mixed feelings,Neutral
337,Why are you so nervous ²,Anxiety,2024-12-03,why are you so nervous ²,Neutral
338,even though I don't miss anyone but I'm still restless,Anxiety,2024-12-04,even though i dont miss anyone but im still restless,Neutral
339,"This is how it feels.. not calm, restless don't know why, I wake up and wake up, my heart feels like it's piling up thinking about something..",Anxiety,2024-12-05,this is how it feels not calm restless dont know why i wake up and wake up my heart feels like its piling up thinking about something,Negative
340,Feeling restless,Anxiety,2024-12-06,feeling restless,Neutral
341,"Panic, restlessness right now “ˆ",Anxiety,2024-12-07,panic restlessness right now ˆ,Positive
342,"I just want to sleep, oh God, I'm not even sure it's clear",Anxiety,2024-12-08,i just want to sleep oh god im not even sure its clear,Positive
343,very restless,Anxiety,2024-12-09,very restless,Positive
344,"don't want to sleep, don't be restless far",Anxiety,2024-12-10,dont want to sleep dont be restless far,Positive
345,"Want to sleep, all restless",Anxiety,2024-12-11,want to sleep all restless,Neutral
346,"I get traumatized. when he was a child, he was said to be ugly because he had a mole. When I grew up around high school I was also said to be ugly with a guy. Do you have a mole, is it a defect? is it a mistake i have a mole? I don't know why lately I'm starting to worry about this problem again",Anxiety,2024-12-12,i get traumatized when he was a child he was said to be ugly because he had a mole when i grew up around high school i was also said to be ugly with a guy do you have a mole is it a defect is it a mistake i have a mole i dont know why lately im starting to worry about this problem again,Negative
347,I shouldn't worry about fate. Because even a leaf God has arranged to fall when and where,Anxiety,2024-12-13,i shouldnt worry about fate because even a leaf god has arranged to fall when and where,Neutral
348,"[Cm] Please calm me down, friends â. Say ""it's okay"" if my research is taking a long time. ""It's okay"" if you haven't written a thesis yet. ""It's okay"" if graduation is a bit behind the plan. Is that okay??? â. I'm starting to get restless myself :(( my research is already 5 months because (+2 months internship)ðŸ˜",Anxiety,2024-12-14,cm please calm me down friends â say its okay if my research is taking a long time its okay if you havent written a thesis yet its okay if graduation is a bit behind the plan is that okay â im starting to get restless myself  my research is already 5 months because 2 months internshipðÿ,Positive
349,"When “relying on yourself” is the best answer to forget anger, anxiety, and disappointment",Anxiety,2024-12-15,when relying on yourself is the best answer to forget anger anxiety and disappointment,Negative
350,2 weeks until the exam and already starting to get restless and have a lot of thoughts,Anxiety,2024-12-16,2 weeks until the exam and already starting to get restless and have a lot of thoughts,Neutral
351,"Why is it that if there are a lot of people talking in front of the house, there are too many motorbikes that pass by, the feeling is immediately restless, afraid, gt",Anxiety,2024-12-17,why is it that if there are a lot of people talking in front of the house there are too many motorbikes that pass by the feeling is immediately restless afraid gt,Negative
352,"Usually every night when you're alone you're restless, it's calm. It feels so different.",Anxiety,2024-12-18,usually every night when youre alone youre restless its calm it feels so different,Positive
353,"you can worry, you can worry. no one forbids.",Anxiety,2024-12-19,you can worry you can worry no one forbids,Neutral
354,duhh why am I worried tbtb,Anxiety,2024-12-20,duhh why am i worried tbtb,Neutral
355,"I'm tired, aren't I, lately I've been nervous about something, I want to hurry up and wait for the time to come and then it's over huh '‹",Anxiety,2024-12-21,im tired arent i lately ive been nervous about something i want to hurry up and wait for the time to come and then its over huh ,Negative
356,I'm worried about speed,Anxiety,2024-12-22,im worried about speed,Neutral
357,"Happiness and sadness move in one door, no need to worry about this life process.",Anxiety,2024-12-23,happiness and sadness move in one door no need to worry about this life process,Positive
358,"Don't worry, your story is written by the best screenwriter",Anxiety,2024-12-24,dont worry your story is written by the best screenwriter,Positive
359,Vala lage na ar,Anxiety,2024-12-25,vala lage na ar,Neutral
360,Mama eto pera kan life e,Anxiety,2024-12-26,mama eto pera kan life e,Neutral
361,Fuck the life,Anxiety,2024-12-27,fuck the life,Negative
362,Go to hell,Anxiety,2024-12-28,go to hell,Neutral
363,Fucking hate you,Anxiety,2024-12-29,fucking hate you,Negative
364,Hell yeah varsity life,Anxiety,2024-12-30,hell yeah varsity life,Neutral
365,Why so much pressure?,Anxiety,2024-12-31,why so much pressure,Positive
366,I can't take any more pressure pls!,Anxiety,2025-01-01,i cant take any more pressure pls,Positive
367,I want to exhale the restlessness in my chest with my breath,Anxiety,2025-01-02,i want to exhale the restlessness in my chest with my breath,Neutral
368,Porasonar mayre bap,Anxiety,2025-01-03,porasonar mayre bap,Neutral
369,Baler question kore rakhce,Anxiety,2025-01-04,baler question kore rakhce,Neutral
370,Vai exam eto kharap hoice,Anxiety,2025-01-05,vai exam eto kharap hoice,Neutral
371,Chintay matha betha kortece,Anxiety,2025-01-06,chintay matha betha kortece,Neutral
372,Get out ,Anxiety,2025-01-07,get out ,Neutral
373,I am fucking tired of everything,Anxiety,2025-01-08,i am fucking tired of everything,Negative
374,"It's getting closer to Eid Al-Fitr, there is a feeling of restlessness and restlessness even though I can cover it with my smile.. It's been almost 8 years of Hari Raya without meaning and getting used to it... Just be grateful to Allah that I can still fast for Ramadan and Eid... That's it",Anxiety,2025-01-09,its getting closer to eid alfitr there is a feeling of restlessness and restlessness even though i can cover it with my smile its been almost 8 years of hari raya without meaning and getting used to it just be grateful to allah that i can still fast for ramadan and eid thats it,Positive
375,I don't like feeling like this!! Kind of restless,Anxiety,2025-01-10,i dont like feeling like this kind of restless,Positive
376,Restless tonight,Anxiety,2025-01-11,restless tonight,Neutral
377,I've been restless since yesterday :(,Anxiety,2025-01-12,ive been restless since yesterday ,Neutral
378,3 days anxious tremor,Anxiety,2025-01-13,3 days anxious tremor,Negative
379,Still hopeful,Anxiety,2025-01-14,still hopeful,Neutral
380,"I want to ask. I'm an extrovert, but the more I come here, the more scared I am when I meet a lot of people, I feel anxious right away. Does anyone know why that is?",Anxiety,2025-01-15,i want to ask im an extrovert but the more i come here the more scared i am when i meet a lot of people i feel anxious right away does anyone know why that is,Positive
381,"Why is it that every time I do my job I'm always restless, I'm so dizzy, it's so hard I can't focus, please",Anxiety,2025-01-16,why is it that every time i do my job im always restless im so dizzy its so hard i cant focus please,Negative
